{
  "format": 1,
  "kind": "segment",
  "segment": "seg-inst_5f3c9a2b7e1d4c08-29817484-0.ndjson",
  "bytes": 18234,
  "sha256": "sha256:5555555555555555555555555555555555555555555555555555555555555555",
  "rows": 12,
  "instanceId": "inst_5f3c9a2b7e1d4c08",
  "organizationId": "org_7d3f9a2b",
  "agentId": "agt_4e8c1b6d",
  "target": "prod",
  "closedAt": "2026-09-12T10:04:10Z",
  "report": {
    "protocol": "0.3.4",
    "instanceId": "inst_5f3c9a2b7e1d4c08",
    "sdk": {
      "name": "agent-sdk-typescript",
      "version": "0.3.0",
      "protocolRange": ">=0.1.0 <1.0.0"
    },
    "host": {
      "os": "linux",
      "arch": "arm64",
      "runtime": "node/22.11.0"
    },
    "syncMode": "offline",
    "generation": {
      "active": 41,
      "staged": 42
    },
    "activeReleaseDigest": "sha256:aaaaaaaaaaaaaaaaaaaaaaaaaaaaaaaaaaaaaaaaaaaaaaaaaaaaaaaaaaaaaaaa",
    "stagedReleaseDigest": "sha256:528680a15cb512714c8328f1a3ba634a64e359b0c11686c1abbe4396a27267eb",
    "applyState": "awaiting_unlock",
    "signingKeyId": "d248f03be9e1629a74451cb3b5de16e0809bcf35db684b71b6f935231e756cc8",
    "storageProtection": "kms",
    "catalog": {
      "models": [
        "claude-sonnet-5",
        "gpt-5"
      ],
      "variables": [
        "customer_name"
      ],
      "reportedAt": "2026-09-12T10:04:00Z"
    },
    "lease": {
      "expiresAt": "2026-09-12T11:00:00Z",
      "expired": false
    },
    "localRollback": {
      "active": false,
      "forced": false
    },
    "applyPolicy": {
      "effective": "unlock_required",
      "source": "pinned"
    }
  }
}
